[
  {
    "id": "ru:general:shopping-basics:skolko-eto-stoit",
    "phrase": "Сколько это стоит?",
    "language": "ru",
    "level": "A1",
    "register": "neutral",
    "situation": "shopping-basics",
    "domain": "general",
    "related_vocabulary": [
      "ru:skolko:pronoun",
      "ru:stoit:adjective",
      "ru:stoit:verb"
    ]
  },
  {
    "id": "ru:general:shopping-basics:ya-khotel-by-kupit-eto",
    "phrase": "Я хотел бы купить это",
    "language": "ru",
    "level": "A1",
    "register": "neutral",
    "situation": "shopping-basics",
    "domain": "general",
    "related_vocabulary": [
      "ru:khotet:verb",
      "ru:kupit:verb"
    ]
  },
  {
    "id": "ru:general:shopping-basics:u-vas-est-eto-bolshego-razmera",
    "phrase": "У вас есть это большего размера?",
    "language": "ru",
    "level": "A1",
    "register": "formal",
    "situation": "shopping-basics",
    "domain": "general",
    "related_vocabulary": [
      "ru:est:verb",
      "ru:bolshoi:adjective",
      "ru:razmer:noun"
    ]
  },
  {
    "id": "ru:general:shopping-basics:mozhno-oplalit-kartoi",
    "phrase": "Можно оплатить картой?",
    "language": "ru",
    "level": "A1",
    "register": "neutral",
    "situation": "shopping-basics",
    "domain": "general",
    "related_vocabulary": [
      "ru:karta:noun"
    ]
  },
  {
    "id": "ru:general:shopping-basics:ya-zaplachu-nalichnymi",
    "phrase": "Я заплачу наличными",
    "language": "ru",
    "level": "A1",
    "register": "neutral",
    "situation": "shopping-basics",
    "domain": "general",
    "related_vocabulary": [
      "ru:nalichnye:noun"
    ]
  },
  {
    "id": "ru:general:shopping-basics:mozhno-chek-pozhaluista",
    "phrase": "Можно чек, пожалуйста?",
    "language": "ru",
    "level": "A1",
    "register": "neutral",
    "situation": "shopping-basics",
    "domain": "general",
    "related_vocabulary": [
      "ru:chek:noun",
      "ru:pozhaluista:phrase"
    ]
  },
  {
    "id": "ru:general:shopping-basics:ya-prosto-smotru-spasibo",
    "phrase": "Я просто смотрю, спасибо",
    "language": "ru",
    "level": "A1",
    "register": "informal",
    "situation": "shopping-basics",
    "domain": "general",
    "related_vocabulary": [
      "ru:smotret:verb",
      "ru:spasibo:phrase"
    ]
  },
  {
    "id": "ru:general:shopping-basics:gde-primerochnaya",
    "phrase": "Где примерочная?",
    "language": "ru",
    "level": "A1",
    "register": "neutral",
    "situation": "shopping-basics",
    "domain": "general",
    "related_vocabulary": [
      "ru:gde:pronoun"
    ]
  },
  {
    "id": "ru:general:shopping-basics:eto-slishkom-dorogo",
    "phrase": "Это слишком дорого",
    "language": "ru",
    "level": "A1",
    "register": "neutral",
    "situation": "shopping-basics",
    "domain": "general",
    "related_vocabulary": []
  },
  {
    "id": "ru:general:shopping-basics:mozhno-eto-primerit",
    "phrase": "Можно это примерить?",
    "language": "ru",
    "level": "A1",
    "register": "neutral",
    "situation": "shopping-basics",
    "domain": "general",
    "related_vocabulary": [
      "ru:primerit:verb"
    ]
  }
]
