[
  {
    "id": "el:travel:emergency-and-survival:pou-einai-i-toualeta",
    "phrase": "Πού είναι η τουαλέτα;",
    "language": "el",
    "level": "A1",
    "register": "neutral",
    "situation": "emergency-and-survival",
    "domain": "travel",
    "related_vocabulary": []
  },
  {
    "id": "el:travel:emergency-and-survival:mporeite-na-me-voithisete",
    "phrase": "Μπορείτε να με βοηθήσετε;",
    "language": "el",
    "level": "A1",
    "register": "formal",
    "situation": "emergency-and-survival",
    "domain": "travel",
    "related_vocabulary": [
      "el:mporo:verb",
      "el:voithao:verb"
    ]
  },
  {
    "id": "el:travel:emergency-and-survival:chreiazomai-giatro",
    "phrase": "Χρειάζομαι γιατρό",
    "language": "el",
    "level": "A1",
    "register": "neutral",
    "situation": "emergency-and-survival",
    "domain": "travel",
    "related_vocabulary": [
      "el:chreiazomai:verb",
      "el:giatros:noun"
    ]
  },
  {
    "id": "el:travel:emergency-and-survival:kaleste-tin-astynomia",
    "phrase": "Καλέστε την αστυνομία",
    "language": "el",
    "level": "A1",
    "register": "formal",
    "situation": "emergency-and-survival",
    "domain": "travel",
    "related_vocabulary": []
  },
  {
    "id": "el:travel:emergency-and-survival:echo-chathei",
    "phrase": "Έχω χαθεί",
    "language": "el",
    "level": "A1",
    "register": "neutral",
    "situation": "emergency-and-survival",
    "domain": "travel",
    "related_vocabulary": [
      "el:echo:verb",
      "el:chano:verb"
    ]
  },
  {
    "id": "el:travel:emergency-and-survival:eimai-allergikos-se",
    "phrase": "Είμαι αλλεργικός σε...",
    "language": "el",
    "level": "A1",
    "register": "neutral",
    "situation": "emergency-and-survival",
    "domain": "travel",
    "related_vocabulary": []
  },
  {
    "id": "el:travel:emergency-and-survival:einai-eleftheri-afti-i-thesi",
    "phrase": "Είναι ελεύθερη αυτή η θέση;",
    "language": "el",
    "level": "A1",
    "register": "neutral",
    "situation": "emergency-and-survival",
    "domain": "travel",
    "related_vocabulary": []
  }
]
