[
  {
    "id": "el:general:daily-routine-talk:xypnao-stis-epta",
    "phrase": "Ξυπνάω στις επτά",
    "language": "el",
    "level": "A1",
    "register": "neutral",
    "situation": "daily-routine-talk",
    "domain": "general",
    "related_vocabulary": [
      "el:xypnao:verb",
      "el:epta:number"
    ]
  },
  {
    "id": "el:general:daily-routine-talk:ti-ora-sikoneste",
    "phrase": "Τι ώρα σηκώνεστε;",
    "language": "el",
    "level": "A1",
    "register": "formal",
    "situation": "daily-routine-talk",
    "domain": "general",
    "related_vocabulary": [
      "el:ora:noun"
    ]
  },
  {
    "id": "el:general:daily-routine-talk:troo-proino-to-proi",
    "phrase": "Τρώω πρωινό το πρωί",
    "language": "el",
    "level": "A1",
    "register": "neutral",
    "situation": "daily-routine-talk",
    "domain": "general",
    "related_vocabulary": [
      "el:troo:verb",
      "el:proino:noun",
      "el:proi:noun"
    ]
  },
  {
    "id": "el:general:daily-routine-talk:pigaino-sti-douleia-me-to-leoforeio",
    "phrase": "Πηγαίνω στη δουλειά με το λεωφορείο",
    "language": "el",
    "level": "A1",
    "register": "neutral",
    "situation": "daily-routine-talk",
    "domain": "general",
    "related_vocabulary": [
      "el:pigaino:verb",
      "el:leoforeio:noun"
    ]
  },
  {
    "id": "el:general:daily-routine-talk:teleiono-ti-douleia-stis-pente",
    "phrase": "Τελειώνω τη δουλειά στις πέντε",
    "language": "el",
    "level": "A1",
    "register": "neutral",
    "situation": "daily-routine-talk",
    "domain": "general",
    "related_vocabulary": [
      "el:teleiono:verb",
      "el:pente:number"
    ]
  },
  {
    "id": "el:general:daily-routine-talk:ti-kanete-to-vready",
    "phrase": "Τι κάνετε το βράδυ;",
    "language": "el",
    "level": "A1",
    "register": "formal",
    "situation": "daily-routine-talk",
    "domain": "general",
    "related_vocabulary": [
      "el:kano:verb",
      "el:vready:noun"
    ]
  },
  {
    "id": "el:general:daily-routine-talk:mageirevo-vradino-kathe-mera",
    "phrase": "Μαγειρεύω βραδινό κάθε μέρα",
    "language": "el",
    "level": "A1",
    "register": "neutral",
    "situation": "daily-routine-talk",
    "domain": "general",
    "related_vocabulary": [
      "el:vradino:noun"
    ]
  },
  {
    "id": "el:general:daily-routine-talk:pigaino-gia-ypno-stis-deka",
    "phrase": "Πηγαίνω για ύπνο στις δέκα",
    "language": "el",
    "level": "A1",
    "register": "neutral",
    "situation": "daily-routine-talk",
    "domain": "general",
    "related_vocabulary": [
      "el:pigaino:verb",
      "el:deka:number"
    ]
  },
  {
    "id": "el:general:daily-routine-talk:kano-panta-ntous",
    "phrase": "Κάνω πάντα ντους",
    "language": "el",
    "level": "A1",
    "register": "neutral",
    "situation": "daily-routine-talk",
    "domain": "general",
    "related_vocabulary": [
      "el:kano:verb",
      "el:panta:adverb"
    ]
  },
  {
    "id": "el:general:daily-routine-talk:vlepo-tileorasi-meta-to-fagito",
    "phrase": "Βλέπω τηλεόραση μετά το φαγητό",
    "language": "el",
    "level": "A1",
    "register": "neutral",
    "situation": "daily-routine-talk",
    "domain": "general",
    "related_vocabulary": [
      "el:vlepo:verb",
      "el:tileorasi:noun",
      "el:meta:preposition"
    ]
  }
]
