[
  {
    "id": "ru:travel:everyday-transactions:ya-ne-ponimayu",
    "phrase": "Я не понимаю",
    "language": "ru",
    "level": "A1",
    "register": "neutral",
    "situation": "everyday-transactions",
    "domain": "travel",
    "related_vocabulary": [
      "ru:ponimat:verb"
    ]
  },
  {
    "id": "ru:travel:everyday-transactions:ya-ne-govoryu-po-russki",
    "phrase": "Я не говорю по-русски",
    "language": "ru",
    "level": "A1",
    "register": "neutral",
    "situation": "everyday-transactions",
    "domain": "travel",
    "related_vocabulary": [
      "ru:govorit:verb"
    ]
  },
  {
    "id": "ru:travel:everyday-transactions:vy-govorite-po-russki",
    "phrase": "Вы говорите по-русски?",
    "language": "ru",
    "level": "A1",
    "register": "formal",
    "situation": "everyday-transactions",
    "domain": "travel",
    "related_vocabulary": [
      "ru:govorit:verb"
    ]
  },
  {
    "id": "ru:travel:everyday-transactions:skolko-eto-stoit",
    "phrase": "Сколько это стоит?",
    "language": "ru",
    "level": "A1",
    "register": "neutral",
    "situation": "everyday-transactions",
    "domain": "travel",
    "related_vocabulary": [
      "ru:skolko:pronoun",
      "ru:stoit:adjective",
      "ru:stoit:verb"
    ]
  },
  {
    "id": "ru:travel:everyday-transactions:eto-daleko",
    "phrase": "Это далеко?",
    "language": "ru",
    "level": "A1",
    "register": "neutral",
    "situation": "everyday-transactions",
    "domain": "travel",
    "related_vocabulary": []
  },
  {
    "id": "ru:travel:everyday-transactions:odin-bilet-pozhaluista",
    "phrase": "Один билет, пожалуйста",
    "language": "ru",
    "level": "A1",
    "register": "neutral",
    "situation": "everyday-transactions",
    "domain": "travel",
    "related_vocabulary": [
      "ru:odin:number",
      "ru:bilet:noun",
      "ru:pozhaluista:phrase"
    ]
  },
  {
    "id": "ru:travel:everyday-transactions:kak-dobratsya-do",
    "phrase": "Как добраться до...?",
    "language": "ru",
    "level": "A1",
    "register": "neutral",
    "situation": "everyday-transactions",
    "domain": "travel",
    "related_vocabulary": [
      "ru:kak:pronoun"
    ]
  },
  {
    "id": "ru:travel:everyday-transactions:kotoryi-chas",
    "phrase": "Который час?",
    "language": "ru",
    "level": "A1",
    "register": "neutral",
    "situation": "everyday-transactions",
    "domain": "travel",
    "related_vocabulary": [
      "ru:chas:noun"
    ]
  },
  {
    "id": "ru:travel:everyday-transactions:ya-khotel-by",
    "phrase": "Я хотел бы...",
    "language": "ru",
    "level": "A1",
    "register": "neutral",
    "situation": "everyday-transactions",
    "domain": "travel",
    "related_vocabulary": [
      "ru:khotet:verb"
    ]
  },
  {
    "id": "ru:travel:everyday-transactions:schyot-pozhaluista",
    "phrase": "Счёт, пожалуйста",
    "language": "ru",
    "level": "A1",
    "register": "neutral",
    "situation": "everyday-transactions",
    "domain": "travel",
    "related_vocabulary": [
      "ru:pozhaluista:phrase"
    ]
  },
  {
    "id": "ru:travel:everyday-transactions:ya-ischu",
    "phrase": "Я ищу...",
    "language": "ru",
    "level": "A1",
    "register": "neutral",
    "situation": "everyday-transactions",
    "domain": "travel",
    "related_vocabulary": []
  }
]
