[
  {
    "id": "el:general:describing-family:afti-einai-i-mitera-mou",
    "phrase": "Αυτή είναι η μητέρα μου",
    "language": "el",
    "level": "A1",
    "register": "neutral",
    "situation": "describing-family",
    "domain": "general",
    "related_vocabulary": [
      "el:mitera:noun"
    ]
  },
  {
    "id": "el:general:describing-family:echo-dyo-adelfia",
    "phrase": "Έχω δύο αδέλφια",
    "language": "el",
    "level": "A1",
    "register": "neutral",
    "situation": "describing-family",
    "domain": "general",
    "related_vocabulary": [
      "el:echo:verb",
      "el:dyo:number",
      "el:adelfos:noun"
    ]
  },
  {
    "id": "el:general:describing-family:echete-paidia",
    "phrase": "Έχετε παιδιά;",
    "language": "el",
    "level": "A1",
    "register": "formal",
    "situation": "describing-family",
    "domain": "general",
    "related_vocabulary": [
      "el:echo:verb",
      "el:paidi:noun"
    ]
  },
  {
    "id": "el:general:describing-family:echo-mia-megali-oikogeneia",
    "phrase": "Έχω μια μεγάλη οικογένεια",
    "language": "el",
    "level": "A1",
    "register": "neutral",
    "situation": "describing-family",
    "domain": "general",
    "related_vocabulary": [
      "el:echo:verb",
      "el:megalos:adjective",
      "el:oikogeneia:noun"
    ]
  },
  {
    "id": "el:general:describing-family:o-pateras-mou-einai-giatros",
    "phrase": "Ο πατέρας μου είναι γιατρός",
    "language": "el",
    "level": "A1",
    "register": "neutral",
    "situation": "describing-family",
    "domain": "general",
    "related_vocabulary": [
      "el:pateras:noun",
      "el:giatros:noun"
    ]
  },
  {
    "id": "el:general:describing-family:posa-adelfia-echete",
    "phrase": "Πόσα αδέλφια έχετε;",
    "language": "el",
    "level": "A1",
    "register": "formal",
    "situation": "describing-family",
    "domain": "general",
    "related_vocabulary": [
      "el:adelfos:noun",
      "el:echo:verb"
    ]
  },
  {
    "id": "el:general:describing-family:eimai-monachopaidi",
    "phrase": "Είμαι μοναχοπαίδι",
    "language": "el",
    "level": "A1",
    "register": "neutral",
    "situation": "describing-family",
    "domain": "general",
    "related_vocabulary": [
      "el:paidi:noun"
    ]
  },
  {
    "id": "el:general:describing-family:i-adelfi-mou-menei-stin-athina",
    "phrase": "Η αδελφή μου μένει στην Αθήνα",
    "language": "el",
    "level": "A1",
    "register": "neutral",
    "situation": "describing-family",
    "domain": "general",
    "related_vocabulary": [
      "el:adelfi:noun",
      "el:meno:verb",
      "el:athina:noun"
    ]
  },
  {
    "id": "el:general:describing-family:eiste-pantremenos",
    "phrase": "Είστε παντρεμένος;",
    "language": "el",
    "level": "A1",
    "register": "formal",
    "situation": "describing-family",
    "domain": "general",
    "related_vocabulary": []
  },
  {
    "id": "el:general:describing-family:aftoi-einai-oi-goneis-mou",
    "phrase": "Αυτοί είναι οι γονείς μου",
    "language": "el",
    "level": "A1",
    "register": "neutral",
    "situation": "describing-family",
    "domain": "general",
    "related_vocabulary": [
      "el:goneis:noun"
    ]
  }
]
