[
  {
    "id": "en:relocation:bureaucracy-and-adjustment:i-d-like-to-request-an-extension",
    "phrase": "I'd like to request an extension",
    "language": "en",
    "level": "B1",
    "register": "formal",
    "situation": "bureaucracy-and-adjustment",
    "domain": "relocation",
    "related_vocabulary": [
      "en:extension:noun"
    ]
  },
  {
    "id": "en:relocation:bureaucracy-and-adjustment:could-you-clarify-what-this-means",
    "phrase": "Could you clarify what this means?",
    "language": "en",
    "level": "B1",
    "register": "formal",
    "situation": "bureaucracy-and-adjustment",
    "domain": "relocation",
    "related_vocabulary": [
      "en:clarify:verb"
    ]
  },
  {
    "id": "en:relocation:bureaucracy-and-adjustment:is-there-a-fee-for-this-service",
    "phrase": "Is there a fee for this service?",
    "language": "en",
    "level": "B1",
    "register": "neutral",
    "situation": "bureaucracy-and-adjustment",
    "domain": "relocation",
    "related_vocabulary": [
      "en:fee:noun"
    ]
  },
  {
    "id": "en:relocation:bureaucracy-and-adjustment:how-long-does-the-process-usually-take",
    "phrase": "How long does the process usually take?",
    "language": "en",
    "level": "B1",
    "register": "neutral",
    "situation": "bureaucracy-and-adjustment",
    "domain": "relocation",
    "related_vocabulary": [
      "en:process:noun"
    ]
  },
  {
    "id": "en:relocation:bureaucracy-and-adjustment:i-d-like-to-file-a-complaint",
    "phrase": "I'd like to file a complaint",
    "language": "en",
    "level": "B1",
    "register": "formal",
    "situation": "bureaucracy-and-adjustment",
    "domain": "relocation",
    "related_vocabulary": [
      "en:complaint:noun"
    ]
  },
  {
    "id": "en:relocation:bureaucracy-and-adjustment:could-you-explain-the-next-steps",
    "phrase": "Could you explain the next steps?",
    "language": "en",
    "level": "B1",
    "register": "neutral",
    "situation": "bureaucracy-and-adjustment",
    "domain": "relocation",
    "related_vocabulary": [
      "en:explain:verb"
    ]
  },
  {
    "id": "en:relocation:bureaucracy-and-adjustment:i-m-having-trouble-with",
    "phrase": "I'm having trouble with...",
    "language": "en",
    "level": "B1",
    "register": "neutral",
    "situation": "bureaucracy-and-adjustment",
    "domain": "relocation"
  },
  {
    "id": "en:relocation:bureaucracy-and-adjustment:i-was-wondering-if",
    "phrase": "I was wondering if...",
    "language": "en",
    "level": "B1",
    "register": "neutral",
    "situation": "bureaucracy-and-adjustment",
    "domain": "relocation"
  },
  {
    "id": "en:relocation:bureaucracy-and-adjustment:would-it-be-possible-to",
    "phrase": "Would it be possible to...?",
    "language": "en",
    "level": "B1",
    "register": "formal",
    "situation": "bureaucracy-and-adjustment",
    "domain": "relocation"
  },
  {
    "id": "en:relocation:bureaucracy-and-adjustment:i-appreciate-your-help",
    "phrase": "I appreciate your help",
    "language": "en",
    "level": "B1",
    "register": "neutral",
    "situation": "bureaucracy-and-adjustment",
    "domain": "relocation",
    "related_vocabulary": [
      "en:help:verb"
    ]
  },
  {
    "id": "en:relocation:bureaucracy-and-adjustment:thank-you-for-your-patience",
    "phrase": "Thank you for your patience",
    "language": "en",
    "level": "B1",
    "register": "formal",
    "situation": "bureaucracy-and-adjustment",
    "domain": "relocation",
    "related_vocabulary": [
      "en:patience:noun"
    ]
  },
  {
    "id": "en:relocation:bureaucracy-and-adjustment:i-look-forward-to-hearing-from-you",
    "phrase": "I look forward to hearing from you",
    "language": "en",
    "level": "B1",
    "register": "formal",
    "situation": "bureaucracy-and-adjustment",
    "domain": "relocation"
  },
  {
    "id": "en:relocation:bureaucracy-and-adjustment:please-let-me-know-if-you-need-anything-else",
    "phrase": "Please let me know if you need anything else",
    "language": "en",
    "level": "B1",
    "register": "neutral",
    "situation": "bureaucracy-and-adjustment",
    "domain": "relocation"
  },
  {
    "id": "en:relocation:bureaucracy-and-adjustment:i-m-still-adjusting-to",
    "phrase": "I'm still adjusting to...",
    "language": "en",
    "level": "B1",
    "register": "neutral",
    "situation": "bureaucracy-and-adjustment",
    "domain": "relocation",
    "related_vocabulary": [
      "en:adjust:verb",
      "en:adjustment:noun"
    ]
  },
  {
    "id": "en:relocation:bureaucracy-and-adjustment:it-s-been-challenging-but",
    "phrase": "It's been challenging, but...",
    "language": "en",
    "level": "B1",
    "register": "neutral",
    "situation": "bureaucracy-and-adjustment",
    "domain": "relocation"
  },
  {
    "id": "en:relocation:bureaucracy-and-adjustment:i-m-getting-used-to",
    "phrase": "I'm getting used to...",
    "language": "en",
    "level": "B1",
    "register": "neutral",
    "situation": "bureaucracy-and-adjustment",
    "domain": "relocation"
  },
  {
    "id": "en:relocation:bureaucracy-and-adjustment:overall-i-think",
    "phrase": "Overall, I think...",
    "language": "en",
    "level": "B1",
    "register": "neutral",
    "situation": "bureaucracy-and-adjustment",
    "domain": "relocation"
  },
  {
    "id": "en:relocation:bureaucracy-and-adjustment:in-my-experience",
    "phrase": "In my experience...",
    "language": "en",
    "level": "B1",
    "register": "neutral",
    "situation": "bureaucracy-and-adjustment",
    "domain": "relocation",
    "related_vocabulary": [
      "en:experience:noun"
    ]
  },
  {
    "id": "en:relocation:bureaucracy-and-adjustment:compared-to-my-home-country",
    "phrase": "Compared to my home country...",
    "language": "en",
    "level": "B1",
    "register": "neutral",
    "situation": "bureaucracy-and-adjustment",
    "domain": "relocation",
    "related_vocabulary": [
      "en:country:noun"
    ]
  }
]
