[
  {
    "id": "en:travel:everyday-transactions:i-think-there-s-a-mistake-on-the-bill",
    "phrase": "I think there's a mistake on the bill",
    "language": "en",
    "level": "A2",
    "register": "neutral",
    "situation": "everyday-transactions",
    "domain": "travel",
    "related_vocabulary": [
      "en:mistake:noun",
      "en:bill:noun"
    ]
  },
  {
    "id": "en:travel:everyday-transactions:how-do-i-get-there-from-here",
    "phrase": "How do I get there from here?",
    "language": "en",
    "level": "A2",
    "register": "neutral",
    "situation": "everyday-transactions",
    "domain": "travel",
    "related_vocabulary": [
      "en:get:verb"
    ]
  }
]
