[
  {
    "id": "en:general:describing-family:this-is-my-mother",
    "phrase": "This is my mother",
    "language": "en",
    "level": "A1",
    "register": "neutral",
    "situation": "describing-family",
    "domain": "general",
    "related_vocabulary": [
      "en:mother:noun",
      "en:my:pronoun"
    ]
  },
  {
    "id": "en:general:describing-family:i-have-two-brothers",
    "phrase": "I have two brothers",
    "language": "en",
    "level": "A1",
    "register": "neutral",
    "situation": "describing-family",
    "domain": "general",
    "related_vocabulary": [
      "en:have:verb",
      "en:two:number",
      "en:brother:noun"
    ]
  },
  {
    "id": "en:general:describing-family:do-you-have-any-children",
    "phrase": "Do you have any children?",
    "language": "en",
    "level": "A1",
    "register": "neutral",
    "situation": "describing-family",
    "domain": "general",
    "related_vocabulary": [
      "en:have:verb",
      "en:child:noun"
    ]
  },
  {
    "id": "en:general:describing-family:i-have-a-big-family",
    "phrase": "I have a big family",
    "language": "en",
    "level": "A1",
    "register": "neutral",
    "situation": "describing-family",
    "domain": "general",
    "related_vocabulary": [
      "en:big:adjective",
      "en:family:noun"
    ]
  },
  {
    "id": "en:general:describing-family:my-father-is-a-doctor",
    "phrase": "My father is a doctor",
    "language": "en",
    "level": "A1",
    "register": "neutral",
    "situation": "describing-family",
    "domain": "general",
    "related_vocabulary": [
      "en:father:noun",
      "en:doctor:noun"
    ]
  },
  {
    "id": "en:general:describing-family:how-many-brothers-and-sisters-do-you-have",
    "phrase": "How many brothers and sisters do you have?",
    "language": "en",
    "level": "A1",
    "register": "neutral",
    "situation": "describing-family",
    "domain": "general",
    "related_vocabulary": [
      "en:brother:noun",
      "en:sister:noun",
      "en:have:verb"
    ]
  },
  {
    "id": "en:general:describing-family:i-am-an-only-child",
    "phrase": "I am an only child",
    "language": "en",
    "level": "A1",
    "register": "neutral",
    "situation": "describing-family",
    "domain": "general",
    "related_vocabulary": [
      "en:child:noun",
      "en:only:adverb"
    ]
  },
  {
    "id": "en:general:describing-family:my-sister-lives-in-paris",
    "phrase": "My sister lives in Paris",
    "language": "en",
    "level": "A1",
    "register": "neutral",
    "situation": "describing-family",
    "domain": "general",
    "related_vocabulary": [
      "en:sister:noun",
      "en:live:verb"
    ]
  },
  {
    "id": "en:general:describing-family:are-you-married",
    "phrase": "Are you married?",
    "language": "en",
    "level": "A1",
    "register": "neutral",
    "situation": "describing-family",
    "domain": "general",
    "related_vocabulary": [
      "en:married:adjective"
    ]
  },
  {
    "id": "en:general:describing-family:these-are-my-parents",
    "phrase": "These are my parents",
    "language": "en",
    "level": "A1",
    "register": "neutral",
    "situation": "describing-family",
    "domain": "general",
    "related_vocabulary": [
      "en:parent:noun",
      "en:my:pronoun"
    ]
  }
]
