[
  {
    "id": "en:general:greetings-and-introductions:hello-nice-to-meet-you",
    "phrase": "Hello, nice to meet you",
    "language": "en",
    "level": "A1",
    "register": "neutral",
    "situation": "greetings-and-introductions",
    "domain": "general",
    "related_vocabulary": [
      "en:hello:phrase",
      "en:nice:adjective",
      "en:meet:verb"
    ]
  },
  {
    "id": "en:general:greetings-and-introductions:good-morning-how-are-you",
    "phrase": "Good morning, how are you?",
    "language": "en",
    "level": "A1",
    "register": "neutral",
    "situation": "greetings-and-introductions",
    "domain": "general",
    "related_vocabulary": [
      "en:good-morning:phrase"
    ]
  },
  {
    "id": "en:general:greetings-and-introductions:my-name-is-john",
    "phrase": "My name is John",
    "language": "en",
    "level": "A1",
    "register": "neutral",
    "situation": "greetings-and-introductions",
    "domain": "general",
    "related_vocabulary": [
      "en:my:pronoun",
      "en:name:noun"
    ]
  },
  {
    "id": "en:general:greetings-and-introductions:what-is-your-name",
    "phrase": "What is your name?",
    "language": "en",
    "level": "A1",
    "register": "neutral",
    "situation": "greetings-and-introductions",
    "domain": "general",
    "related_vocabulary": [
      "en:what:pronoun",
      "en:your:pronoun",
      "en:name:noun"
    ]
  },
  {
    "id": "en:general:greetings-and-introductions:nice-to-meet-you-too",
    "phrase": "Nice to meet you too",
    "language": "en",
    "level": "A1",
    "register": "neutral",
    "situation": "greetings-and-introductions",
    "domain": "general",
    "related_vocabulary": [
      "en:nice:adjective",
      "en:meet:verb"
    ]
  },
  {
    "id": "en:general:greetings-and-introductions:see-you-later",
    "phrase": "See you later",
    "language": "en",
    "level": "A1",
    "register": "informal",
    "situation": "greetings-and-introductions",
    "domain": "general",
    "related_vocabulary": [
      "en:see:verb",
      "en:later:adverb"
    ]
  },
  {
    "id": "en:general:greetings-and-introductions:have-a-nice-day",
    "phrase": "Have a nice day",
    "language": "en",
    "level": "A1",
    "register": "neutral",
    "situation": "greetings-and-introductions",
    "domain": "general",
    "related_vocabulary": [
      "en:have:verb",
      "en:nice:adjective",
      "en:day:noun"
    ]
  },
  {
    "id": "en:general:greetings-and-introductions:good-evening",
    "phrase": "Good evening",
    "language": "en",
    "level": "A1",
    "register": "formal",
    "situation": "greetings-and-introductions",
    "domain": "general",
    "related_vocabulary": [
      "en:good:adjective",
      "en:evening:noun"
    ]
  },
  {
    "id": "en:general:greetings-and-introductions:goodbye-take-care",
    "phrase": "Goodbye, take care",
    "language": "en",
    "level": "A1",
    "register": "neutral",
    "situation": "greetings-and-introductions",
    "domain": "general",
    "related_vocabulary": [
      "en:goodbye:phrase",
      "en:take:verb",
      "en:care:noun"
    ]
  },
  {
    "id": "en:general:greetings-and-introductions:this-is-my-friend",
    "phrase": "This is my friend",
    "language": "en",
    "level": "A1",
    "register": "neutral",
    "situation": "greetings-and-introductions",
    "domain": "general",
    "related_vocabulary": [
      "en:friend:noun",
      "en:my:pronoun"
    ]
  }
]
