[
  {
    "id": "ru:travel:emergency-and-survival:gde-tualet",
    "phrase": "Где туалет?",
    "language": "ru",
    "level": "A1",
    "register": "neutral",
    "situation": "emergency-and-survival",
    "domain": "travel",
    "related_vocabulary": [
      "ru:gde:pronoun"
    ]
  },
  {
    "id": "ru:travel:emergency-and-survival:vy-mozhete-mne-pomoch",
    "phrase": "Вы можете мне помочь?",
    "language": "ru",
    "level": "A1",
    "register": "formal",
    "situation": "emergency-and-survival",
    "domain": "travel",
    "related_vocabulary": [
      "ru:moch:verb",
      "ru:pomoch:verb"
    ]
  },
  {
    "id": "ru:travel:emergency-and-survival:mne-nuzhen-vrach",
    "phrase": "Мне нужен врач",
    "language": "ru",
    "level": "A1",
    "register": "neutral",
    "situation": "emergency-and-survival",
    "domain": "travel",
    "related_vocabulary": [
      "ru:vrach:noun"
    ]
  },
  {
    "id": "ru:travel:emergency-and-survival:vyzovite-politsiyu",
    "phrase": "Вызовите полицию",
    "language": "ru",
    "level": "A1",
    "register": "formal",
    "situation": "emergency-and-survival",
    "domain": "travel",
    "related_vocabulary": [
      "ru:politsiya:noun"
    ]
  },
  {
    "id": "ru:travel:emergency-and-survival:ya-zabludilsya",
    "phrase": "Я заблудился",
    "language": "ru",
    "level": "A1",
    "register": "neutral",
    "situation": "emergency-and-survival",
    "domain": "travel",
    "related_vocabulary": []
  },
  {
    "id": "ru:travel:emergency-and-survival:u-menya-allergiya-na",
    "phrase": "У меня аллергия на...",
    "language": "ru",
    "level": "A1",
    "register": "neutral",
    "situation": "emergency-and-survival",
    "domain": "travel",
    "related_vocabulary": [
      "ru:allergiya:noun"
    ]
  },
  {
    "id": "ru:travel:emergency-and-survival:eto-mesto-svobodno",
    "phrase": "Это место свободно?",
    "language": "ru",
    "level": "A1",
    "register": "neutral",
    "situation": "emergency-and-survival",
    "domain": "travel",
    "related_vocabulary": []
  }
]
