[
  {
    "id": "fr:travel:everyday-transactions:je-ne-comprends-pas",
    "phrase": "Je ne comprends pas",
    "language": "fr",
    "level": "A1",
    "register": "neutral",
    "situation": "everyday-transactions",
    "domain": "travel",
    "related_vocabulary": [
      "fr:comprendre:verb"
    ]
  },
  {
    "id": "fr:travel:everyday-transactions:je-ne-parle-pas-francais",
    "phrase": "Je ne parle pas français",
    "language": "fr",
    "level": "A1",
    "register": "neutral",
    "situation": "everyday-transactions",
    "domain": "travel",
    "related_vocabulary": [
      "fr:parler:verb"
    ]
  },
  {
    "id": "fr:travel:everyday-transactions:parlez-vous-francais",
    "phrase": "Parlez-vous français ?",
    "language": "fr",
    "level": "A1",
    "register": "formal",
    "situation": "everyday-transactions",
    "domain": "travel",
    "related_vocabulary": [
      "fr:parler:verb"
    ]
  },
  {
    "id": "fr:travel:everyday-transactions:combien-ca-coute",
    "phrase": "Combien ça coûte ?",
    "language": "fr",
    "level": "A1",
    "register": "neutral",
    "situation": "everyday-transactions",
    "domain": "travel",
    "related_vocabulary": [
      "fr:couter:verb"
    ]
  },
  {
    "id": "fr:travel:everyday-transactions:est-ce-loin",
    "phrase": "Est-ce loin ?",
    "language": "fr",
    "level": "A1",
    "register": "neutral",
    "situation": "everyday-transactions",
    "domain": "travel",
    "related_vocabulary": [
      "fr:etre:verb",
      "fr:loin:adverb"
    ]
  },
  {
    "id": "fr:travel:everyday-transactions:un-billet-s-il-vous-plait",
    "phrase": "Un billet, s'il vous plaît",
    "language": "fr",
    "level": "A1",
    "register": "neutral",
    "situation": "everyday-transactions",
    "domain": "travel",
    "related_vocabulary": [
      "fr:billet:noun",
      "fr:s-il-vous-plait:phrase"
    ]
  },
  {
    "id": "fr:travel:everyday-transactions:comment-aller-a",
    "phrase": "Comment aller à... ?",
    "language": "fr",
    "level": "A1",
    "register": "neutral",
    "situation": "everyday-transactions",
    "domain": "travel",
    "related_vocabulary": [
      "fr:aller:verb"
    ]
  },
  {
    "id": "fr:travel:everyday-transactions:quelle-heure-est-il",
    "phrase": "Quelle heure est-il ?",
    "language": "fr",
    "level": "A1",
    "register": "neutral",
    "situation": "everyday-transactions",
    "domain": "travel",
    "related_vocabulary": [
      "fr:heure:noun",
      "fr:etre:verb"
    ]
  },
  {
    "id": "fr:travel:everyday-transactions:je-voudrais",
    "phrase": "Je voudrais...",
    "language": "fr",
    "level": "A1",
    "register": "neutral",
    "situation": "everyday-transactions",
    "domain": "travel",
    "related_vocabulary": [
      "fr:vouloir:verb"
    ]
  },
  {
    "id": "fr:travel:everyday-transactions:l-addition-s-il-vous-plait",
    "phrase": "L'addition, s'il vous plaît",
    "language": "fr",
    "level": "A1",
    "register": "neutral",
    "situation": "everyday-transactions",
    "domain": "travel",
    "related_vocabulary": [
      "fr:s-il-vous-plait:phrase"
    ]
  },
  {
    "id": "fr:travel:everyday-transactions:je-cherche",
    "phrase": "Je cherche...",
    "language": "fr",
    "level": "A1",
    "register": "neutral",
    "situation": "everyday-transactions",
    "domain": "travel",
    "related_vocabulary": [
      "fr:chercher:verb"
    ]
  }
]
