[
  {
    "id": "it:general:classroom-language:aprite-i-libri-a-pagina-dieci",
    "phrase": "Aprite i libri a pagina dieci",
    "language": "it",
    "level": "A1",
    "register": "neutral",
    "situation": "classroom-language",
    "domain": "general",
    "related_vocabulary": [
      "it:libro:noun",
      "it:dieci:number"
    ]
  },
  {
    "id": "it:general:classroom-language:puoi-ripetere-per-favore",
    "phrase": "Puoi ripetere, per favore?",
    "language": "it",
    "level": "A1",
    "register": "informal",
    "situation": "classroom-language",
    "domain": "general",
    "related_vocabulary": [
      "it:potere:verb",
      "it:ripetere:verb",
      "it:per-favore:phrase"
    ]
  },
  {
    "id": "it:general:classroom-language:come-si-scrive",
    "phrase": "Come si scrive?",
    "language": "it",
    "level": "A1",
    "register": "neutral",
    "situation": "classroom-language",
    "domain": "general",
    "related_vocabulary": [
      "it:scrivere:verb"
    ]
  },
  {
    "id": "it:general:classroom-language:che-cosa-significa-questa-parola",
    "phrase": "Che cosa significa questa parola?",
    "language": "it",
    "level": "A1",
    "register": "neutral",
    "situation": "classroom-language",
    "domain": "general",
    "related_vocabulary": [
      "it:significare:verb",
      "it:parola:noun"
    ]
  },
  {
    "id": "it:general:classroom-language:ho-una-domanda",
    "phrase": "Ho una domanda",
    "language": "it",
    "level": "A1",
    "register": "neutral",
    "situation": "classroom-language",
    "domain": "general",
    "related_vocabulary": [
      "it:avere:verb",
      "it:domanda:noun"
    ]
  },
  {
    "id": "it:general:classroom-language:posso-aprire-la-finestra",
    "phrase": "Posso aprire la finestra?",
    "language": "it",
    "level": "A1",
    "register": "informal",
    "situation": "classroom-language",
    "domain": "general",
    "related_vocabulary": [
      "it:potere:verb",
      "it:aprire:verb",
      "it:finestra:noun"
    ]
  },
  {
    "id": "it:general:classroom-language:per-favore-scrivete-questo",
    "phrase": "Per favore, scrivete questo",
    "language": "it",
    "level": "A1",
    "register": "neutral",
    "situation": "classroom-language",
    "domain": "general",
    "related_vocabulary": [
      "it:per-favore:phrase",
      "it:scrivere:verb"
    ]
  },
  {
    "id": "it:general:classroom-language:lavorate-in-coppia",
    "phrase": "Lavorate in coppia",
    "language": "it",
    "level": "A1",
    "register": "neutral",
    "situation": "classroom-language",
    "domain": "general",
    "related_vocabulary": [
      "it:lavorare:verb"
    ]
  },
  {
    "id": "it:general:classroom-language:scusa-sono-in-ritardo",
    "phrase": "Scusa, sono in ritardo",
    "language": "it",
    "level": "A1",
    "register": "informal",
    "situation": "classroom-language",
    "domain": "general",
    "related_vocabulary": [
      "it:essere:verb",
      "it:ritardo:noun"
    ]
  },
  {
    "id": "it:general:classroom-language:ascoltate-attentamente",
    "phrase": "Ascoltate attentamente",
    "language": "it",
    "level": "A1",
    "register": "neutral",
    "situation": "classroom-language",
    "domain": "general",
    "related_vocabulary": [
      "it:ascoltare:verb"
    ]
  }
]
